{
  "schemaVersion": 2,
  "sceneName": "ReferenceScene",
  "generatedRootName": "AI_Generated_Scene",
  "theme": "custom_reference_scene",
  "generatorVersion": "scene_v2",
  "seed": 20260807,
  "referenceImage": {
    "assetPath": "Assets/ReferenceImages/Scene.png",
    "width": 1920,
    "height": 1080,
    "analysisPreset": "custom_reference_scene"
  },
  "visualNotes": [
    "Codex fills the visual analysis before preview generation."
  ],
  "camera": {
    "position": { "x": 0.0, "y": 8.0, "z": -18.0 },
    "lookAt": { "x": 0.0, "y": 1.3, "z": 5.0 },
    "fieldOfView": 42.0,
    "nearClipPlane": 0.1,
    "farClipPlane": 120.0
  },
  "lighting": {
    "sunEuler": { "x": 35.0, "y": -35.0, "z": 0.0 },
    "sunColor": { "r": 1.0, "g": 0.86, "b": 0.48, "a": 1.0 },
    "sunIntensity": 2.2,
    "ambientSkyColor": { "r": 0.58, "g": 0.82, "b": 0.78, "a": 1.0 },
    "ambientEquatorColor": { "r": 0.48, "g": 0.62, "b": 0.35, "a": 1.0 },
    "ambientGroundColor": { "r": 0.25, "g": 0.32, "b": 0.18, "a": 1.0 },
    "fogColor": { "r": 0.68, "g": 0.9, "b": 0.82, "a": 1.0 },
    "fogDensity": 0.012,
    "bloomIntensity": 0.55
  },
  "terrain": {
    "enabled": false,
    "objectName": "Generated_Ground",
    "createColorPatches": false,
    "size": { "x": 42.0, "y": 32.0 },
    "groundYOffset": 0.0,
    "grassPatchCount": 0,
    "baseGrassColor": { "r": 0.55, "g": 0.78, "b": 0.12, "a": 1.0 },
    "patchGrassA": { "r": 0.67, "g": 0.84, "b": 0.16, "a": 1.0 },
    "patchGrassB": { "r": 0.42, "g": 0.66, "b": 0.13, "a": 1.0 }
  },
  "features": {
    "centralFeature": false,
    "magicPools": false,
    "heroForegroundTrees": false,
    "heroTreePrefabGuids": [],
    "heroTreePrefabPaths": [],
    "heroTreeAssetKeywords": [],
    "clouds": false,
    "fog": false,
    "postProcessing": false
  },
  "centralFeature": {
    "position": { "x": 0.0, "y": 0.0, "z": 7.5 },
    "usePrefabAltar": false,
    "altarPrefabGuid": "",
    "altarPrefabPath": "",
    "ringStonePrefabGuids": [],
    "ringStonePrefabPaths": [],
    "ringStoneAssetKeywords": [],
    "allowKeywordFallback": false,
    "altarRadius": 2.3,
    "altarHeight": 0.65,
    "heartHeight": 2.45,
    "glowIntensity": 4.0,
    "glowColor": { "r": 0.47, "g": 1.0, "b": 0.08, "a": 1.0 }
  },
  "objects": [],
  "scatterGroups": []
}
